URL,Lyrics,Chords
https://tabs.ultimate-guitar.com/tab/luis-fonsi/despacito-chords-1932541,"Fonsi Dididiri Daddy Go! Si, sabes que ya llevo rato mirÅEÅEΩ°ndote Tengo que bailar contigo hoy Vi, que tu mirada ya estaba llamÅEÅEΩ°ndome MuÅEÅEΩ©strame el camino que yo voy TÅEÅEΩ∫, tÅEÅEΩ∫ eres el imÅEÅEΩ°n y yo soy el metal Me voy acercando y voy armando el plan Solo con pensarlo se acelera el pulso Ya, ya me estÅEÅEΩ° gustando mÅEÅEΩ°s de lo normal Todos mis sentidos van pidiendo mÅEÅEΩ°s Esto hay que tomarlo sin ningÅEÅEΩ∫n apuro Despacito Quiero respirar tu cuello despacito Deja que te diga cosas al oÅEÅEΩ≠do Para que te acuerdes si no estÅEÅEΩ°s conmigo Despacito Quiero desnudarte a besos despacito Firmo en las paredes de tu laberinto Y hacer de tu cuerpo todo un manuscrito Quiero ver bailar tu pelo Quiero ser tu ritmo Que le enseÅEÅEΩ±es a mi boca Tus lugares favoritos DÅEÅEΩ©jame sobrepasar tus zonas de peligro Hasta provocar tus gritos Y que olvides tu apellido Si te pido un beso, ven dÅEÅEΩ°rmelo Yo sÅEÅEΩ© que estÅEÅEΩ°s pensÅEÅEΩ°ndolo Llevo tiempo intentÅEÅEΩ°ndolo Mami esto es dando y dÅEÅEΩ°ndolo Sabes que tu corazÅEÅEΩ≥n conmigo te hace bom bom Sabes que esa beba estÅEÅEΩ° buscando de mi bom bom Ven prueba de mi boca para ver como te sabe Quiero quiero, quiero ver cuanto amor a ti te cabe Yo no tengo prisa yo me quiero dar el viaje Empezamos lento, despuÅEÅEΩ©s salvaje Pasito a pasito, suave suavecito Nos vamos pegando, poquito a poquito Cuando tÅEÅEΩ∫ me besas, con esa destreza Veo que eres malicia, con delicadeza Pasito a pasito, suave suavecito Nos vamos pegando, poquito a poquito Y es que esa belleza, es un rompecabezas Pero pa' montarlo aquÅEÅEΩ≠ tengo la pieza Despacito Quiero respirar tu cuello despacito Deja que te diga cosas al oÅEÅEΩ≠do Para que te acuerdes si no estÅEÅEΩ°s conmigo Despacito Quiero desnudarte a besos despacito Firmo en las paredes de tu laberinto Y hacer de tu cuerpo todo un manuscrito Sube, sube, sube, sube, sube Quiero ver bailar tu pelo Quiero ser tu ritmo Que le enseÅEÅEΩ±es a mi boca Tus lugares favoritos DÅEÅEΩ©jame sobrepasar tus zonas de peligro Hasta provocar tus gritos Y que olvides tu apellido Despacito Vamo' hacerlo en una playa en Puerto Rico Hasta que las olas griten Á™∂Âíåy bendito' Para que mis hechos se queden contigo Pasito a pasito, suave suavecito Nos vamos pegando, poquito a poquito Que le enseÅEÅEΩ±es a mi boca Tus lugares favoritos Pasito a pasito, suave suavecito Nos vamos pegando, poquito a poquito Hasta provocar tus gritos Y que olvides tu apellido Despacito",Bm G D A Bm G D A Bm G D A Bm G D A Bm G D A Bm G D A A Bm G D A Bm G D A Bm Bm G G D A Bm G D A Bm G D A Bm G D A A Bm G D A Bm G D A A Bm G D A Bm G D A A Bm G D A Bm G D A Bm G D A Bm
https://tabs.ultimate-guitar.com/tab/coldplay/the-scientist-chords-50712,"Come up to meet you, tell you I'm sorry You don't know how lovely you are I had to find you, tell you I need you Tell you I set you apart Tell me your secrets, and ask me your questions Oh, let's go back to the start Running in circles, coming up tails Heads on a science apart Nobody said it was easy It's such a shame for us to part Nobody said it was easy No one ever said it would be this hard Oh, take me back to the start I was just guessing at numbers and figures Pulling the puzzles apart Questions of science, science and progress Do not speak as loud as my heart Tell me you love me, come back and haunt me Oh, and I rush to the start Running in circles, chasing our tails Coming back as we are Nobody said it was easy Oh, it's such a shame for us to part Nobody said it was easy No one ever said it would be so hard I'm going back to the start",Am7 F C C B D A Am7 F C C B Am7 F C C B Am7 F C C B Am7 F C C B Am7 F C C B F C C B F C C B C6 G C C F C C Am7 F C C B Am7 F C C Am7 F C C Am7 F C C C B Am7 F C C C B F C C B F C C B C6 G C C F C C Am7 F C C Am7 F C C Am7 F C C Am7 F C C B Am7 F C
https://tabs.ultimate-guitar.com/tab/misc-christmas/silent-night-chords-1201071,"Silent night, Holy night, All is calm all is bright Round yon virgin mother and child, Holy infant so tender and mild Silent night, Holy night, Shepherds quake at the sight Glories stream from Heaven afar, heavenly hosts sing Hallelujah Silent night, Holy night, Son of God love's pure light Radiant beams from thy holy face, With the dawn of redeeming grace",G B G D A E D D7 G B G D A E C G B G D A E D G Em B G D A E G D G B G D A E G D D7 G C G C G D D7 G Em G D G G D D7 G C G C G D D7 G Em G D G G D D7 G C G C G D D7 G Em G D G
https://tabs.ultimate-guitar.com/tab/the-beatles/something-chords-335727,"Something in the way she moves, Ammaj I don't wanna leave her now, Somewhere in her smile she knows, Ammaj I don't wanna leave her now, You know I believe and how m m You're asking me will my love grow, I don't know, I don't know m m You stick around now, it may show, I don't know, I don't know Ammaj Something in the way she knows, Ammaj",F C F Eb G D C B G D A E F A F Eb G D A B G D A E A A C C A C B G D A E G D Cmaj7 C7 F E G A G7 B Am7 D9 C#m G F#m7 F Eb G D C Cmaj7 C7 F F F E D7 G G A G7 B Am Am7 D9 F Eb G D C Cmaj7 C7 F F F E D7 G G A G7 B Am Am7 D9 F Eb G D A A C#m G F#m7 A E D G A A C#m G F#m7 A E D G C C Cmaj7 C7 F F F E D7 G G A G7 B Am Am7 D9 F Eb G D C Cmaj7 C7 F F F E D7 G G A G7 B Am Am7 D9 F Eb G D A F Eb G D C
https://tabs.ultimate-guitar.com/tab/mariah-carey/all-i-want-for-christmas-is-you-chords-903566,"MalletVibraphone I don't want a lot for Christmas There is just one thing I need I don't care about the presents Underneath the Christmas tree I just want you for my own More than you could ever know Make my wish come true Cm Youou yeah I don't want a lot for Christmas There is just one thing I need don't care about the presents Underneath the Christmas tree I don't need to hang my stocking There upon the fireplace Santa Claus won't make me happy With a toy on Christmas day I just want you for my own More than you could ever know Make my wish come true Cm All I want for Christmas is you You, baby Oh, I won't ask for much this Christmas I won't even wish for snow I'm just gonna keep on waiting Underneath the mistletoe I won't make a list and send it To the North Pole for Saint Nick I won't even stay awake to Hear those magic reindeer click 'Cause I just want you here tonight Holding on to me so tight What more can I do Cm Oh baby, all I want for Christmas is you You, baby All the lights are shining So brightly everywhere And the sound of children's Laughter fills the air And everyone is singing I hear those sleigh bells ringing Santa won't you bring me the one I really need Oh, I don't want a lot for Christmas This is all I'm asking for I just want to see my baby Standing right outside my door Oh, I just want you for my own More than you could ever know Make my wish come true Cm You",G Em C D G G B C Cm Eb G D B7 Em Cm Eb G D E7 Am7 D G Em C D G C Eb6 G C Eb6 G B7 Em Eb6 G D E7 Am7 Eb G Em Am7 D G C Eb6 G C Eb6 G B7 Em Eb6 G D E7 Am7 Eb G Em Am7 D B7 Em B7 Em Eb6 G D E7 Am7 Am7 D G C Eb6 G B7 Em Eb6 G D E7 Am7 D D G Em Am7 D G Em Am7 D G Em Am7 D G Em Am7 D G Em Am7 D G Em Am7 D
https://tabs.ultimate-guitar.com/tab/gnarls-barkley/crazy-chords-377909,"I remember when, I remember, I remember when I lost my mind Even your emotions had an echo In so much space And when you're out there, without care, Yeah, I was out of touch But it wasn't because I didn't know enough I just knew too much Does that make me crazy? Does that make me crazy?? Does that make me crazy??? And I hope that you are having the time of your life But think twice, that's my only advice Come on now, who do you, who do you, who do you, who do you think you are, Ha ha ha bless your soul You really think you're in control Well, I think you're crazy! I think you're crazy! I think you're crazy, My heroes had the heart to lose their lives out on a limb And all I remember is thinking, I wanna be like them Ever since I was little, ever since I was little it looked like fun And it's no coincidence I've come And I can die when I'm done Maybe I'm crazy Maybe you're crazy Maybe we're crazy Probably",Am Cmaj7 F Esus4 E Am Cmaj7 F Esus4 E Am C F Esus4 E A F Cmaj7 Esus4 E Am C F Esus4 E Am Cmaj7 F Esus4 E A F Cmaj7 Esus4 E Am C F Esus4 E Am Cmaj7 F Esus4 E A F Cmaj7 Esus4 E Am
https://tabs.ultimate-guitar.com/tab/the-calling/wherever-you-will-go-chords-37465,"So lately, been wondering who will be there to take my place When I'm gone you'll need love to light the shadows on your face If a great wave shall fall and fall upon us all Then between the sand and stone could you make it on your own? If I could then I would, I'll go wherever you will go Way up high or down low, I'll go wherever you will go And maybe I'll find out a way to make it back someday To watch you, to guide you through the darkest of your days If a great wave shall fall and fall upon us all Well, then I hope there's someone out there who can bring me back to you If I could then I would, I'll go wherever you will go Way up high or down low, I'll go wherever you will go Run away with my heart Run away with my hope Run away with my love I know now just quite how My life and love might still go on In your heart, in your mind I'll stay with you for all of time If I could then I would, I'll go wherever you will go Way up high or down low, I'll go wherever you will go If I could turn back time, I'll go wherever you will go If I could make you mine, I'll go wherever you will goooooo oooo I'll go wherever you will gooooooooooo",C G B Am F B G D A E C G Am F C G Am F C G Am F C G Am F C G Am F C G Am F C C G Am F C G Am F C G Am F C G Am F C G Am F C G Am F Am Am F G Em Am F G Em F C G Am F C G Am F C C G Am F C G Am F C G Am F C G Am F C G Am F C G Am F Fmaj7 Fadd9
https://tabs.ultimate-guitar.com/tab/louis-armstrong/what-a-wonderful-world-chords-955258,"I see trees of green, red roses too I see them bloom, for me and you And I think to myself, what a wonderful world I see skies of blue and clouds of white The bright blessed day, the dark sacred night And I think to myself, what a wonderful world The colours of the rainbow, so pretty in the sky Are also on the faces of people going by I see friends shaking hands saying how do you do TheyÁ™∂ÂÜ≥e really saying I love you I hear babies crying, I watch them grow They'll learn much more than I'll ever know And I think to myself, what a wonderful world Yes I think to myself, what a wonderful world",C Dm C Dm C Em F Em Dm C E7 Am Ab Dm7 G C G C Em F Em Dm C E7 Am Ab Dm7 G C Dm Dm C G C G C Am Em Am Em F Em Dm C G C Em F Em Dm C E7 Am Ab Dm7 G C Bb7 A7 Dm7 G7 Cmaj7
https://tabs.ultimate-guitar.com/tab/red-hot-chili-peppers/under-the-bridge-chords-44981,"Sometimes I feel like I don't have a partner Sometimes I feel like My only friend Is the city I live in The city of angels? Lonely as I am Together we cry I drive on her streets 'cause She's my companion I walk through her hills 'cause She knows who I am She sees my good deeds and She kisses me windy I never worry, Now that is a lie m I don't ever want to feel m Like I did that day Take me to the place I love m Take me all the way m I don't ever want to feel m Like I did that day Take me to the place I love m Take me all the way It's hard to believe that There's nobody out there It's hard to believe that I'm all alone At least I have her love The city, she loves me Lonely as I am Together we cry m I don't ever want to feel m Like I did that day Take me to the place I love m Take me all the way m I don't ever want to feel m Like I did that day Take me to the place I love m Take me all the way ay, yeah Yeah, yeah Oh no, no, no Yeah, yeah Love me, I say Yeah, yeah One time Under the bridge downtown Is where I drew some blood Under the bridge downtown I could not get enough Under the bridge downtown Forgot about my love Under the bridge downtown Gave my life away",D F E B C#m G#m A E B C#m A E B C#m G#m A E B C#m A Emaj7 E B C#m G#m A E B C#m A E B C#m G#m A E B C#m A Emaj7 F#m E B F F#m E B F F#m F#m E B F F#m E B F F#m E B C#m G#m A E B C#m A E B C#m G#m A E B C#m A E B C#m G#m A E B C#m A Emaj7 F#m E B F F#m E B F F#m F#m E B F F#m E B F F#m A Am7 G6 Fmaj7 A Am7 G6 Fmaj7 A Am7 G6 Fmaj7 Fmaj7 E7 Gmaj7 A Am G6 Fmaj7 A Am G6 Fmaj7 A Am G6 Fmaj7 A Am G6 Fmaj7
https://tabs.ultimate-guitar.com/tab/scorpions/wind-of-change-chords-102896,"I follow the Moskva Down to Gorky Park Listening to the wind of change An August summer night Soldiers passing by  Listening to the wind of change The world is closing in Did you ever think That we could be so close, like brothers The future's in the air I can feel it everywhere Blowing with the wind of change Take me to the magic of the moment On a glory night Where the children of tomorrow dream away In the wind of change Walking down the street Distant memories Are buried in the past forever I follow the Moskva Down to Gorky Park Listening to the wind of change Take me to the magic of the moment On a glory night Where the children of tomorrow share their dreams With you and me Take me to the magic of the moment On a glory night Where the children of tomorrow dream away In the wind of change The wind of change blows straight Into the face of time Like a stormwind that will ring The freedom bell for peace of mind Let your balalaika sing What my guitar wants to say Take me to the magic of the moment On a glory night Where the children of tomorrow share their dreams With you and me Take me to the magic of the moment On a glory night Where the children of tomorrow dream away In the wind of change",C Dm C Dm Am G C C Dm C Dm Am G C Dm C Dm Am G C C Dm C Dm Am G C G Dm G C G Dm G Am F G C Dm C Dm Am G C C Dm C Dm Am G C G Dm G C G Dm G Am F G C G Dm G C G Dm G Am F G Am G Am G C Dm E C G Dm G C G Dm G Am F G C G Dm G C G Dm G Am F G
https://tabs.ultimate-guitar.com/tab/juan-karlos/buwan-chords-2415745,"Ako'y sayo, ikaw ay akin Ganda mo sa paningin Ako ngayo'y nag iisa Sana ay tabihan na Sa ilalim ng puting ilaw Sa dilaw na buwan Pakinggan mo ang aking sigaw Sa dilaw na buwan Ayaw kong mabuhay ng may lungkot Ikaw ang nag papasaya At makakasama hanggang sa pag tanda Hali na tayo'y humiga Sa ilalim ng puting ilaw Sa dilaw na bwan Pakinggan mo ang aking sigaw Sa dilaw na buwan At iyong ganda'y, umaabot sa buwan Ang tibok ng puso'y, tinig sa kalawakan At kung mabalik, dito sa akin, ikaw ang mahal, ikaw lang ang mamahalin Pakinggan ang puso't damdamin Damdamin aking damdamin Sa ilalim ng puting ilaw Sa dilaw na buwan Pakinggan mo ang aking sigaw Sa dilaw na buwan Ta Taaaa Sa ilalim ng puting ilaw Sa dilaw na buwan Pakinggan mo ang aking sigaw Sa dilaw na buwan Pakinggan mo pakinggan pakinggan mo aking sinta",Am Em Em Am Em Am Am C C D G G7 C D7 G G7 C D7 G C D G C D7 G G7 C D7 G G7 C D7 G C D7 G C D G Em C D G G7 C D7 G Em7 C D G Em7 G C D G Em C D G G7 C D7 G Em7 G C D7 G G7 C D C D G Em7 G C D7 G Em7 G C D
https://tabs.ultimate-guitar.com/tab/counting-crows/mr-jones-chords-16066,"Sha la la la la I was down at the New Amsterdam staring at this yellowhaired girl Jones strikes up a conversation with this blackhaired flamenco dancer She's suddenly beautiful We all want something beautiful, man, I wish I was beautiful So come dance this silence down through the morning Sha la la la la la la la la yeah uh huh yeah Cut up, Maria! Show me some of them Spanish dances Jones Help me believe in anything 'Cause I want to be someone who believes, yeah Jones and me, tell each other fairy tales and we stare at the beautiful women "" Smiling in the bright lights, coming through in stereo When everybody loves you, you can never be lonely Paint myself in blue and red and black and gray All of the beautiful colors are very, very meaningful Gray is my favorite color II felt so symbolic yesterday If I knew Picasso I would buy myself a gray guitar and play Jones and me, look into the future yeah we stare at the beautiful women "" Standing in the spotlight, I bought myself a gray guitar When everybody loves me, I will never be loonely I will never be lonely I'm never gonna be looonely Everybody wants to pass as cats Believe in me because I don't believe in anything Jones and me, stumbling through the barrio Yeah we stare at the beautiful women "" I want to be Bob Dylan Jones wishes he was someone just a little more funky Jones and me, staring at the video",Am F Dm G Am F G Am F Dm G Am F G Am F Dm G Am F G Am F Dm G Am F G Am F Dm G Am F G Am F Dm G Am F G C F G C F G G C F G C F G Am F Dm G Am F G Am F Dm G Am F G C F G C F G C F G C F G Am Fmaj7 Am G Am F Am G Am F Am G C F G C F G C F G C F G C F G C F G C F G C F G C F G
https://tabs.ultimate-guitar.com/tab/radiohead/creep-chords-51053,"When you were here before, You're just like an angel, You float like a feather, in a beautiful world I wish I was special, What the hell am I doing here? I don't care if it hurts, I want a perfect body, I want you to notice, You're so fucking special, What the hell am I doing here? Whatever makes you happy, You're so fucking special, I wish I was special, What the hell am I doing here? I don't belong here,",C E F Fm C E F Fm C E F Fm C E F Fm C E F Fm C E F Fm C E F Fm C E F Fm C E F Fm C E F Fm C E F Fm C
https://tabs.ultimate-guitar.com/tab/billie-eilish/lovely-chords-2371539,"Thought I found a way Thought I found a way, out But you never go away So I guess I gotta stay now Oh, I hope some day I'll make it out of here Even if it takes all night or a hundred years Need a place to hide, but I can't find one near Wanna feel alive, outside I can't fight my fear Isn't it lovely, all alone Heart made of glass, my mind of stone Tear me to pieces, skin to bone Hello, welcome home Walkin' out of time Lookin' for a better place Something's on my mind Always in my headspace But I know some day I'll make it out of here Even if it takes all night or a hundred years Need a place to hide, but I can't find one near Wanna feel alive, outside I can't fight my fear Isn't it lovely, all alone Heart made of glass, my mind of stone Tear me to pieces, skin to bone Hello, welcome home Woahoah, yeahyeah, ah Yeahhhhhhh, Ohohohohohhhohhh Woah, woah Hello, welcome hooooome",Em C Em Bm C Em Bm C Em Bm C Em Bm C Em Bm C Em Bm C Em Bm C Em Bm C Em Bm C Em Bm C C Em Bm C Em Bm C Em Bm C Em Bm C Em Bm C Em Bm C Em Bm C Em Bm C Em Bm C Em Bm C Em Bm C Em Bm Cmaj7 E
https://tabs.ultimate-guitar.com/tab/156298,"oooooo oooooo oooooo oooooo oooooo oooooo oooooo oooooo Somewhere over the rainbow, way up high And the dreams that you dream of once in a lullaby Oh somewhere over the rainbow, blue birds fly And the dreams that you dream of, dreams really do come true Someday i'll wish upon a star Wake up where the clouds are far behind me Where trouble melts like lemon drops High above the chimney tops that's where you'll find me Oh somewhere over the rainbow, blue birds fly And the dreams that you dare to, oh why, oh why can't I? Well I see trees of green and Red roses too I'll watch then bloom for me and you And I think to myself: what a wonderful world Well I see skies of blue and I see clouds of white And the brightness of day, I like the dark And I think to myself: what a wonderful world The colours of the rainbow so pretty in the sky Are also on the faces of people passing bye See friends shaking hands, saying 'how do you do?' I love you I hear babies cry and I watch them grow They'll learn much more than we'll know And I think to myself: what a wonderful world Someday i'll wish upon a star Wake up where the clouds are far behind me Where trouble melts like lemon drops High above the chimney tops that's where you'll find me Oh somewhere over the rainbow, way up high And the dreams that you dare to, why, oh why can't I? oooooo oooooo oooooo oooooo oooooo oooooo oooeh",A G D Em C G D Em C G D F C G C Bm7 Em C G D F C B Em7 D C G B D A Em C G D F C B Em7 D C G B D A Em C G D F Em C G D F Em C G D F C B Em7 D C G B D A Em C G D C B Em7 D C G B D A Em B C D A Em C G D C B Em7 D C G B D A Em B C D A G C G D A Em B D A Em B C B Em7 D C B Em7 D C B Em7 D C D G D C B Em7 D C G B D A Em B C D A Em C G D F Em C G D F Em C G D F C B Em7 D C G B D A Em C G D F C G C Bm7 Em C A A A A A A A A G D Em C D F Bm7 C B Em7 D Em G B D A
https://tabs.ultimate-guitar.com/tab/bob-dylan/dont-think-twice-its-all-right-chords-178850,"Well, it ain't no use to sit and wonder why, babe If'n you don't know by now An' it ain't no use to sit and wonder why, babe It'll never do somehow When your rooster crows at the break of dawn Look out your window and I'll be gone You're the reason I'm atrav'lin' on But don't think twice, it's all right And it ain't no use in aturnin' on your light, babe The light I never knowed An' it ain't no use in turnin' on your light, babe I'm on the dark side of the road But I wish there was somethin' you would do or say To try and make me change my mind and stay We never did too much talkin' anyway Don't think twice, it's all right No, it ain't no use in callin' out my name, gal Like you never done before And it ain't no use in callin' out my name, gal I can't hear you anymore I'm athinkin' and awond'rin' walkin' down the road I once loved a woman, a child I am told I gave her my heart but she wanted my soul Don't think twice, it's all right So loooooong, honey babe Where I'm bound, I can't tell But goodbye's too good a word, babe So I'll just say fare thee well I ain't sayin' you treated me unkind You could have done better but I don't mind You just kinda wasted my precious time Don't think twice, it's all right",C G C G F C G C C G Am F C G C G Am D7 G G7 C C7 F D7 C G Am F C G C C G Am F C C G Am F C G C G Am D7 G G7 C C7 F D7 C G Am F C G C C G Am F C C G Am F C G C G Am D7 G G7 C C7 F D7 C G Am F C G C C G Am F C C G Am F C G C G Am D7 G G7 C C7 F D7 C G Am F C G C C G Am F C C G Am D7 G G7 C C7 F D7 C G C G F C G C
https://tabs.ultimate-guitar.com/tab/taylor-swift/we-are-never-ever-getting-back-together-chords-1175300,"I remember when we broke up the first time saying this is it I've had enough cause like we haven't seen each other in a month when you said you needed space what? Then you come around again and say baby I miss you and I swear I'm gonna change Trust me remember how that lasted for a day I say I hate you we break up you call me I love you Ooh we called it off again last night but ooh this time I'm telling you I'm telling you We are never ever ever getting back together We are never ever ever getting back together You go talk to your friends talk to my friends talk to me but we are never ever ever ever getting back together like ever I'm really gonna miss you picking fights and me falling for it screaming that I'm right And you would hide away and find your peace of mind with some indie record that's much cooler than mine Ooh you called me up again tonight But ooh this time I'm telling you I'm telling you We are never ever ever getting back together We are never ever ever getting back together You go talk to your friends talk to my friends talk to me but we are never ever ever ever getting back together Ooh, ooh, ooh, oh I used to think that we were forever ever and I used to say never say never Ugh so he calls me up and he's like 'I still love you and I'm like 'I'm just sick of it I mean this is exhausting you know like, we are never getting back together like ever We are never ever ever getting back together We are never ever ever getting back together You go talk to your friends talk to my friends talk to me but we are never ever ever ever getting back together We getting back together We oh, getting back together You go talk to your friends talk to my friends talk to me but we are never ever ever ever getting back together x Dead note",Cadd9 Csus2 B G D A E Cadd9 G D Em7 Cadd9 G D Em7 Cadd9 G D Em7 Cadd9 G D Em7 Cadd9 G D Em7 Cadd9 G D Em7 Cadd9 G D Em7 Cadd9 G D Em7 D F Cadd9 G D Em7 D F Cadd9 G D Em7 D F Cadd9 G D D Cadd9 G D Em7 Cadd9 G D Em7 Cadd9 G D Em7 Cadd9 G D Em7 Cadd9 G D Em7 Cadd9 G D Em7 D F Cadd9 G D Em7 D F Cadd9 G D Em7 D F Cadd9 G D D Cadd9 G D Em7 D F Cadd9 G D Em7 D F Cadd9 G D Em7 Cadd9 G D Em7 Cadd9 G D Em7 Cadd9 G D Cadd9 G D Em7 D F Cadd9 G D Em7 D F Cadd9 G D Em7 D F Cadd9 G D Em7 D F Cadd9 G D Em7 D F Cadd9 G D Em7 D F Cadd9 G D Em7 D F Cadd9 G D D
