URL,Lyrics,Chords
https://tabs.ultimate-guitar.com/tab/sia/chandelier-chords-1476462,"Party girls don't get hurt Can't feel anything, when will I learn I push it down, push it doown I'm the one ""for a good time call"" Phone's blowin' up, they're ringin' my doorbell I feel the love, feel the loove One, two, three, one, two, three drink One, two, three, one, two, three drink One, two, three, one, two, three drink Throw em back, till I lose count I'm gonna swing from the chandelier, from the chandelier I'm gonna live like tomorrow doesn't exist, like it doesn't exist I'm gonna fly like a bird through the night, feel my tears as they dry I'm gonna swing from the chandelier, from the chandelier And I'm holding on for dear life, won't look down won't open my eyes Keep my glass full until morning light, 'cause I'm just holding on for tonight Help me, I'm holding on for dear life, won't look down won't open my eyes Keep my glass full until morning light, 'cause I'm just holding on for tonight On for tonight Sun is up, I'm a mess Gotta get out now, gotta run from this Here comes the shame, here comes the shaame One, two, three, one, two, three drink One, two, three, one, two, three drink One, two, three, one, two, three drink Throw em back, till I lose count I'm gonna swing from the chandelier, from the chandelier I'm gonna live like tomorrow doesn't exist, like it doesn't exist I'm gonna fly like a bird through the night, feel my tears as they dry I'm gonna swing from the chandelier, from the chandelier And I'm holding on for dear life, won't look down won't open my eyes Keep my glass full until morning light, 'cause I'm just holding on for tonight Help me, I'm holding on for dear life, won't look down won't open my eyes Keep my glass full until morning light, 'cause I'm just holding on for tonight, on for tonight On for tonight, Yes I'm just holdin' on for tonight Oh I'm just holdin' on for tonight, On for tonight, On for tonight Yes I'm just holdin' on for tonight, yes I'm just holding on for tonight Oh I'm just holdin' on for tonight, On for tonight, On for tonight",Am F G Em Am F G Em F Am G G F G C E F F G C E F F G C E F F G C E F F G C F F G C F F Am F G Em F Am G G F G C E F F G C E F F G C E F F G C E F F G C F F G C F F G C E F F G C E F
https://tabs.ultimate-guitar.com/tab/ben-e-king/stand-by-me-chords-1724608,"King Stand By Me BPM : Capo : II When the night has come and the land is da rk And the mo on is the on ly light we'll see No, I wo n't be af raid, no, I won't be af raid So darlin', darlin' stand by me, oh now stand by me, If the sky that we look upon should tumble and fall And the mount ain should crumble to the sea I won't cry, I won't cry, no, I won't shed a tear And darling, darling stand by me, oh now stand by me, Stand by me, oh now stand by me,",E G G Em Em C D G G G G Em Em C D G G G G Em Em C D G G G G Em Em C D G G G G Em Em C D G G G G Em Em C D G G G G Em Em C D G G G G Em Em C D G G G G Em Em C D G G
https://tabs.ultimate-guitar.com/tab/grover-washington-jr-/just-the-two-of-us-chords-663141,"I see the crystal raindrops fall And the beauty of it all Is when the sun comes shining through To make those rainbows in my mind When I think of you sometime And I wanna spend some time with you Just the two of us, we can make it if we try Just the two of us Just the two of us, building castles in the sky Just the two of us, you and I We look for love, no time for tears Wasted water's all that is And it don't make no flowers grow Good things might come to those who wait But not for those who wait too late We gotta go for all we know Just the two of us, we can make it if we try Just the two of us Just the two of us, building them castles in the sky Just the two of us, you and I h I hear the crystal raindrops fall On the window down the hall And it becomes the morning dew And darling, when the morning comes And I see the morning sun I wanna be the one with you Just the two of us, we can make it if we try Just the two of us Just the two of us, building big castles way on high Just the two of us, you and I",Cmaj7 B7 Em7 Dm7 G7 Ebm7 Cmaj7 B7 Em7 Dm7 G7 Cmaj7 B7 Em7 Cmaj7 B7 Em7 Dm7 G7 Cmaj7 B7 Em7 Cmaj7 B7 Em7 Dm7 G7 Cmaj7 B7 Em7 Cmaj7 B7 Em7 Ebm7 Dm7 G7 Cmaj7 B7 Em7 Cmaj7 B7 Em7 Ebm7 Dm7 G7 Cmaj7 B7 Em7 Cmaj7 B7 Em7 Dm7 G7 Cmaj7 B7 Em7 Cmaj7 B7 Em7 Dm7 G7 Cmaj7 B7 Em7 Cmaj7 B7 Em7 Ebm7 Dm7 G7 Cmaj7 B7 Em7 Cmaj7 B7 Em7 Ebm7 Dm7 G7 Cmaj7 B7 Em7 Cmaj7 B7 Bbmaj7 A7 Abmaj7 G7 Cmaj7 F13 B G D A E Cmaj7 B7 Em7 Dm7 G7 Cmaj7 B7 Em7 Cmaj7 B7 Em7 Dm7 G7 Cmaj7 B7 Em7 Cmaj7 B7 Em7 Dm7 G7 Cmaj7 B7 Em7 Cmaj7 B7 Em7 Ebm7 Dm7 G7 Cmaj7 B7 Em7 Cmaj7 B7 Em7 Ebm7 Dm7 G7 Cmaj7 B7 Em7
https://tabs.ultimate-guitar.com/tab/america/a-horse-with-no-name-chords-59609,"On the first part of the journey I was looking at all the life There were plants and birds and rocks and things There were sand and hills and rings The first thing I met was a fly with a buzz And the sky with no clouds The heat was hot and the ground was dry But the air was full of sound Em Dmaj I've been through the desert on a horse with no name Em Dmaj It felt good to be out of the rain Em Dmaj In the desert you can remember your name Em Dmaj 'Cause there ain't no one for to give you no pain Em Dmaj La, la, la lala la la la, la, la Em Dmaj La, la, la lala la la la, la, la After two days in the desert sun My skin began to turn red After three days in the desert fun I was looking at a river bed And the story it told of a river that flowed Made me sad to think it was dead Em Dmaj You see I've been through the desert on a horse with no name Em Dmaj It felt good to be out of the rain Em Dmaj In the desert you can remember your name Em Dmaj 'Cause there ain't no one for to give you no pain Em Dmaj La, la, la lala la la la, la, la Em Dmaj La, la, la lala la la la, la, la After nine days I let the horse run free 'Cause the desert had turned to sea There were plants and birds and rocks and things There were sand and hills and rings The ocean is a desert with its life underground And a perfect disguise above Under the cities lies a heart made of ground But the humans will give no love Em Dmaj You see, I've been through the desert on a horse with no name Em Dmaj It felt good to be out of the rain Em Dmaj In the desert you can remember your name Em Dmaj 'Cause there ain't no one for to give you no pain Em Dmaj La, la, la lala la la la, la, la Em Dmaj La, la, la lala la la la, la, la Em Dmaj La, la, la lala la la la, la, la Em Dmaj La, la, la lala la la la, la, la Em Dmaj La, la, la lala la la la, la, la Em Dmaj La, la, la lala la la la, la, la Em Dmaj La, la, la lala la la la, la, la Em Dmaj La, la, la lala la la la, la, la",Em Em D6 D6 Em D6 Em D6 Em D6 Em D6 Em D6 Em D6 Em D6 Em D6 Em D6 Em D6 Em D6 Em D6 Em D6 Em D6 Em D6 Em D6 Em D6 Em D6 Em D6 Em D6 Em D6 Em D6
https://tabs.ultimate-guitar.com/tab/misc-christmas/jingle-bells-chords-273336,"Dashing through the snow, in a onehorse open sleigh, Bells on bobtails ring, making spirits bright, Oh! Jingle bells, jingle bells, jingle all the way! Oh what fun it is to ride In a onehorse open sleigh, hey! Jingle bells, jingle bells, jingle all the way! Oh what fun it is to ride In a onehorse open sleigh! day or two ago, I thought I'd take a ride And soon Miss Fanny Bright was seated by my side The horse was lean and lank, misfortune seemed his lot Oh! Jingle bells, jingle bells, jingle all the way! Oh what fun it is to ride In a onehorse open sleigh, hey! Jingle bells, jingle bells, jingle all the way! Oh what fun it is to ride In a onehorse open sleigh! day or two ago, the story I must tell I went out on the snow and on my back I fell gent was riding by in a onehorse open sleigh Oh! Jingle bells, jingle bells, jingle all the way! Oh what fun it is to ride In a onehorse open sleigh, hey! Jingle bells, jingle bells, jingle all the way! Oh what fun it is to ride In a onehorse open sleigh! Now the ground is white, go it while you're young Take the girls along and sing this sleighing song Just bet a bobtailed bay, two forty as his speed Oh! Jingle bells, jingle bells, jingle all the way! Oh what fun it is to ride In a onehorse open sleigh, hey! Jingle bells, jingle bells, jingle all the way! Oh what fun it is to ride In a onehorse open sleigh!",G C Am D7 G G C Am D D7 G D7 G C G C G A7 D7 G C G C G D7 G G C A Am D7 G G C Am D D7 G D7 G C G C G A7 D7 G C G C G D7 G G C A Am D7 G C A Am D D7 G D7 G C G C G A7 D7 G C G C G D7 G G C Am D7 G G C Am D D7 G D7 G C G C G A7 D7 G C G C G D7 G
https://tabs.ultimate-guitar.com/tab/bruno-mars/count-on-me-chords-958496,"If you ever find yourself stuck in the middle of the sea I'll sail the world to find you If you ever find yourself lost in the dark and you can't see I'll be the light to guide you Find out what we're made of When we are called to help our friends in need You can count on me like one, two, three I'll be there And I know when I need it I can count on you like four, three, two And you'll be there 'cos that's what friends are s'posed to do Oh yeah Yeah yeah If you're tossin' and you're turnin' and you just can't fall asleep I'll sing a song beside you And if you ever forget how much you really mean to me Every day I will remind you, oh Find out what we're made of When we are called to help our friends in need You can count on me like one, two, three I'll be there And I know when I need it I can count on you like four, three, two And you'll be there 'cos that's what friends are s'posed to do Oh yeah Yeah yeah You'll always have my shoulder when you cry I'll never let go, never say goodbye, you know [Chorus You can count on me like one, two, three I'll be there And I know when I need it I can count on you like four, three, two And you'll be there 'cos that's what friends are s'posed to do Oh yeah You can count on me cuz I can count on you",C C Em Am G F C Em Am G F Dm Em F G C Em Am G F C Em Am G F C Em Am G F G C Em Am G F C Em Am G F Dm Em F G C Em Am G F C Em Am G F C Em Am G F G Dm Em Am G Dm Em F G C Em Am G F C Em Am G F C Em Am G F C
https://tabs.ultimate-guitar.com/tab/ed-sheeran/happier-chords-1956585,"h h h Hammeron, Ghost note Walking down th and Park I saw you in anotherÁ™∂ÂÜ± arms Only a month weÁ™∂ÂÜµe been apart You look happier Saw you walk inside a bar He said something to make you laugh I saw that both your smiles were twice as wide as ours Yeah, you look happier, you do AinÁ™∂ÂÜ≤ nobody hurt you like I hurt you But ainÁ™∂ÂÜ≤ nobody love you like I do Promise that I will not take it personal, baby If youÁ™∂ÂÜ≥e moving on with someone new Á™∂ÂÉÇause baby you look happier, you do My friends told me one day IÁ™∂ÂõÅEfeel it too And until then IÁ™∂ÂÜ§l smile to hide the truth But I know I was happier with you Sat in the corner of the room EverythingÁ™∂ÂÜ± reminding me of you Nursing an empty bottle and telling myself youÁ™∂ÂÜ≥e happier ArenÁ™∂ÂÜ≤ you? AinÁ™∂ÂÜ≤ nobody hurt you like I hurt you But ainÁ™∂ÂÜ≤ nobody need you like I do I know that thereÁ™∂ÂÜ± others that deserve you But my darling, I am still in love with you But I guess you look happier, you do My friends told me one day IÁ™∂ÂÜ§l feel it too I could try to smile to hide the truth But I know I was happier with you Baby, you look happier, you do I knew one day youÁ™∂ÂõÅEfall for someone new But if he breaks your heart like lovers do Just know that IÁ™∂ÂÜ§l be waiting here for you",Am7 F C B G D A E Am7 F C Am7 F C Am7 F C Am7 F C Am7 F C Am7 F C Am7 F C Am7 F C Am7 F C Am7 F C Am7 F C Am7 F C Am7 F C Am7 F C Am7 F C Am7 F C Am7 F C Am7 F C Am7 F C Am7 F C Am7 F C Am7 F C Am7 F C Am7 F C Am7 F C Am7 F C Am7 F C Am7 F C Am7 F C Am7 F C Am7 F C Am7 F C Am7 F C
https://tabs.ultimate-guitar.com/tab/eagles/take-it-easy-chords-14322,"Dsus Well, I'm arunnin' down the road tryin' to loosen my load I got seven women on my mind Four that wanna own me, two that wanna stone me One says she's a friend of mine Take it easy, take it easy Don't let the sound of your own wheels drive you crazy Lighten up while you still can Don't even try to understand Just find a place to make your stand, and take it easy Well, I'm astandin' on a corner in Winslow, Arizona Such a fine sight to see It's a girl, my Lord, in a flatbed Ford Slowin' down to take a look at me Come on, baby, don't say maybe I gotta know if your sweet love is gonna save me We may lose and we may win, though we may never be here again So open up, I'm climbin' in, so take it easy Well, I'm arunnin' down the road tryin' to loosen my load Got a world of trouble on my mind Lookin' for a lover who won't blow my cover, she's so hard to find Take it easy, take it easy Don't let the sound of your own wheels make you crazy Come on baby, don't say maybe I gotta know if your sweet love is gonna save me Oh oh oh, oh oh oh Oh oh oh, oh oh oh Oh oh oh, oh oh oh Oh oh oh, oh oh oh Oh oh oh, oh oh oh Oh, we got it e e asy We oughta take it e e asy",Am7 G G G Am7 G G G G D C G D C G Em C G Am C Em C G C G Am C G G D C G D C G Em D C G Am C Em C G C G Am C G G G G D C G D C G Em D C G Am C Em Em D G D Am G D C G Em C G Am C Em C G C G Am C G C G C G C G G7 C G G7 C Em
https://tabs.ultimate-guitar.com/tab/taylor-swift/blank-space-chords-1674053,"com Asus STANDARD TUNING w CAPO ON Nice to meet you where you been I can show you incredible things Magic, madness, heaven sin Saw you there and I thought Oh my God, look at that face You look like my next mistake Asus LoveÁ™∂ÂÜ± a game, want to plaaaaay? New money, suit and tie I can read you like a magazine Ain't it funny rumors fly And I know you heard about Me so hey, lets be friends I'm dying to see how this one ends Grab your passport and my hand I can make the bad guys good for a weekend So it's gonna be forever or it's gonna go down in flames You can tell me when it's over mmm If the high was worth the pain Got a long list of exlovers They'll tell you I'm insane Cause you know I love the players and you love the game Cause we're young and we're reckless We'll take this way too far It'll leave you breathless, mmm Or with a nasty scar Got a long list of exlovers They'll tell you I'm insane But I got a blank space baby and I'll write your name Cherry lips, crystal skies I could show you incredible things Stolen kisses, pretty lies You're the king baby I'm your queen Find out what you want Be that girl for a month Asus Wait the worst is yet to come, oh no Screaming crying perfect storms I can make all the tables turn Rose garden filled with thorns Keep you second guessing Like ""Oh my God who is she?"" I get drunk on jealousy But you'll come back each time you leave Cause darlin' I'm a nightmare, dressed like a daydream So it's gonna be forever or it's gonna go down in flames You can tell me when it's over, mm If the high was worth the pain Got a long list of exlovers They'll tell you I'm insane Cause you know I love the players and you love the game Cause we're young and we're reckless We'll take this way too far It'll leave you breathless, mmm Or with a nasty scar Got a long list of exlovers They'll tell you I'm insane But I got a blank space baby and I'll write your name Boys only want love if it's torture Don't say I didn't, say I didn't warn you Boys only want love if it's torture Don't say I didn't, say I didn't warn you So it's gonna be forever or it's gonna go down in flames You can tell me when it's over mmm If the high was worth the pain Got a long list of exlovers They'll tell you I'm insane Cause you know I love the players and you love the game Cause we're young and we're reckless We'll take this way too far It'll leave you breathless, mmm Or with a nasty scar Got a long list of exlovers They'll tell you I'm insane But I got a blank space baby and I'll write your name com",D Bm G A D Bm G A G A D Bm Em G D D Bm Em G G C D D Bm G A D Bm G A G C D Bm Em G D D Bm Em G G C D D D C D Bm Em G D Bm Em G G C
https://tabs.ultimate-guitar.com/tab/bastille/pompeii-chords-1227805,"I was left to my own devices Many days fell away with nothing to show And the walls kept tumbling down In the city that we loved Great clouds roll over the hills Bringing darkness from above But if you close your eyes, Does it almost feel like Nothing changed at all? And if you close your eyes, Does it almost feel like You've been here before? How am I gonna be an optimist about this? How am I gonna be an optimist about this? We were caught up and lost in all of our vices In your pose as the dust settles around us And the walls kept tumbling down In the city that we loved Great clouds roll over the hills Bringing darkness from above But if you close your eyes, Does it almost feel like Nothing changed at all? And if you close your eyes, Does it almost feel like You've been here before? How am I gonna be an optimist about this? How am I gonna be an optimist about this? Oh where do we begin? The rubble or our sins? Oh where do we begin? The rubble or our sins? And the walls kept tumbling down In the city that we loved Great clouds roll over the hills Bringing darkness from above But if you close your eyes, Does it almost feel like Nothing changed at all? And if you close your eyes, Does it almost feel like You've been here before? How am I gonna be an optimist about this? How am I gonna be an optimist about this? If you close your eyes, Does it almost feel like Nothing changed at all?",C G Em D C G Em D C G Em D C G Em D C G Em D C C G Em D C G Em D C G D C G D C G Em D C G Em D C G Em D C G Em D C C G Em D C G Em D C G D C G D C G Em D C G Em D C G Em D C G Em D C G Em D C C G Em D C G Em D C G D C G D C G Em D C G Em D
https://tabs.ultimate-guitar.com/tab/john-denver/leaving-on-a-jet-plane-chords-32979,"All my bags are packed, I'm ready to go I'm standing here outside your door I hate to wake you up to say goodbye But the dawn is breaking, it's early morn, The taxi's waiting, he's blowing his horn Already I'm so lonesome I could die So kiss me and smile for me Tell me that you'll wait for me Hold me like you'll never let me go I'm leaving on a jet plane Don't know when I'll be back again Oh babe, I hate to go There's so many times I've let you down So many times I've played around I tell you now they don't mean a thing Every place I go I'll think of you Every song I sing I'll sing for you When I come back I'll bring your wedding ring So kiss me and smile for me Tell me that you'll wait for me Hold me like you'll never let me go I'm leaving on a jet plane Don't know when I'll be back again Oh babe, I hate to go Now the time has come to leave you One more time let me kiss you Then close your eyes I'll be on my way Dream about the days to come When I won't have to leave alone About the times I won't have to say So kiss me and smile for me Tell me that you'll wait for me Hold me like you'll never let me go I'm leaving on a jet plane Don't know when I'll be back again Oh babe, I hate to go I'm leaving on a jet plane Don't know when I'll be back again Oh babe, I hate to go",D G C G C G C D G C G C G C D G C G C G C D G C G C G C D G C G C G C D G C G C G C D G C G C G C D G C G C G C D G C G C G C D G C G C G C D G C G C G C D G C G C G C D G C G C G C D
https://tabs.ultimate-guitar.com/tab/adam-levine/lost-stars-chords-1496532,"Please don't see Just a boy caught up in dreams and fantasies Please see me Reaching out for someone I can't see Take my hand, let's see where we wake up tomorrow Best laid plans sometimes are just a one night stand I'll be damned, cupid's demanding back his arrow So let's get drunk on our tears and God, tell us the reason Youth is wasted on the young It's hunting season And the lambs are on the run Searching for meaning But are we all lost stars Trying to light up the dark? Who are we? Just a speck of dust within the galaxy Woe is me If we're not careful, turns into reality Don't you dare, let our best memories bring you sorrow Yesterday, I saw a lion kiss a deer Turn the page, maybe we'll find a brand new ending Where we're dancing on our tears God, tell us the reason Youth is wasted on the young It's hunting season And the lambs are on the run Searching for meaning But are we all lost stars Trying to light up the dark? I thought I saw you out there crying I thought I heard you call my name I thought I heard you out there crying Just the same, yeahhhhhhhhh God, tell us the reason Youth is wasted on the young It's hunting season And this lamb is on the run Searching for meaning But are we all lost stars Trying to light up the dark? I thought I saw you out there crying I thought I heard you call my name I thought I heard you out there crying But are we all lost stars Trying to light up the dark? But are we all lost stars Trying to light up the dark?",Fmaj7 Fmaj7 Fmaj7 Fmaj7 Fmaj7 Fmaj7 Em Fmaj7 Em Fmaj7 Em Fmaj7 G G Fmaj7 C Fmaj7 C Fmaj7 Em D D Dm G Fmaj7 Fmaj7 Fmaj7 Fmaj7 Fmaj7 Em Fmaj7 Em Fmaj7 Em Fmaj7 G G Fmaj7 C Fmaj7 C Fmaj7 Em D D Dm G Fmaj7 C Fmaj7 C Fmaj7 C G Fmaj7 Fmaj7 C Fmaj7 C Fmaj7 Em D D Dm G Fmaj7 C Fmaj7 C Fmaj7 Em D D Dm G D D Dm G C
https://tabs.ultimate-guitar.com/tab/leonard-cohen/hallelujah-chords-64977,"Now I've heard there was a secret chord That David played, and it pleased the Lord But you don't really care for music, do you? It goes like this the fourth, the fifth The minor fall, the major lift The baffled king composing Hallelujah Hallelujah, Hallelujah, Hallelujah, Halleluujah Your faith was strong, but you needed proof You saw her bathing on the roof Her beauty and the moonlight overthrew ya She tied you to a kitchen chair She broke your throne, and she cut your hair And from your lips she drew the Hallelujah Hallelujah, Hallelujah, Hallelujah, Halleluujah You say I took the name in vain I don't even know the name But if I did, well really, what's it to ya? There's a blaze of light in every word It doesn't matter which you heard The holy or the broken Hallelujah Hallelujah, Hallelujah, Hallelujah, Halleluujah I did my best, it wasn't much I couldn't feel, so I tried to touch I've told the truth, I didn't come to fool ya And even though it all went wrong I'll stand before the Lord of Song With nothing on my tongue but Hallelujah Hallelujah, Hallelujah, Hallelujah, Hallelujah Hallelujah, Hallelujah, Hallelujah, Hallelujah Hallelujah, Hallelujah, Hallelujah, Hallelujah Hallelujah, Hallelujah, Hallelujah, Hallelujah You can also arpeggiate the chords:",G Em G Em C D G D G C D Em C D B7 Em C Em C G D G D G Em G Em C D G D G C D Em C D B7 Em C Em C G D G D G Em G Em C D G D G C D Em C D B7 Em C Em C G D G D G Em G Em C D G D G C D Em C D B7 Em C Em C G D C Em C G D C Em C G D C Em C G D G G Em C D B7 B G D A E
https://tabs.ultimate-guitar.com/tab/anji/menunggu-kamu-chords-2333561,Jika bukan kepadamu Aku tidak tau lagi Pada siapa rindu ini kan kuberi Pada siapa rindu ini kan kuberi Lihat aku sayang Yang sudah berjuang menunggumu Datang menjemputmu pulang Ingat slalu sayang Hatiku Kau genggam Aku tak kan pergi Menunggu kamu disini Lihat aku sayang Yang sudah berjuang menunggumu Datang menjemputmu pulang Ingat slalu sayang Hatiku Kau genggam Aku tak kan pergi Aku tak kan pergi Menunggu kamu disini,C G Am G F C G C G Am G F Em Dm Em C F G C G Am G F Em Dm Em C F G C E7 Am A Dm A Dm G C E7 Am A Dm Em F G C C G Am G F G C G Am G F Em Dm Em C F G Em C F G C E7 Am A Dm A Dm G C E7 Am A Dm Em F G C C Dm C G C Dm G C E7 Am A Dm A Dm G C E7 Am A Dm Em F Dm Em F G C C B G C
https://tabs.ultimate-guitar.com/tab/taylor-swift/safe-and-sound-chords-1118992,"I remember tears streaming down your face When I said, I'll never let you go When all those shadows almost killed your light I remember you said, Don't leave me here a lone But all that's dead and gone and passed tonight Just close your eyes The sun is going down You'll be alright No one can hurt you now Come morning light You and I'll be safe and sound Don't you dare look out your window Darling everything's on fire The war outside our door keeps raging on Hold on to this lullabye Just close your eyes The sun is going down You'll be alright No one can hurt you now Come morning light You and I'll be safe and sound Just close your eyes You'll be alright Come morning light You and I'll be safe and sound Ooooo Oooo Ohoh com",Em Bm G D Em Bm G D Em Bm G D Em Bm G D Em Bm G G D A G D A G D A Bm A G Em Bm G D Em Bm G D Em Bm G D Em Bm G D Em Bm G G G D A G D A G D A Bm A G G D Bm A G D A G D A G D A Bm A G G D A G D A
