URL,Lyrics,Chords
https://tabs.ultimate-guitar.com/tab/the-beatles/let-it-be-chords-60690,"Let It Be Written and performed by: The Beatles When I find myself in times of trouble, Mother Mary comes to me Speaking words of wisdom, let it be And in my hour of darkness, She is standing right in front of me Speaking words of wisdom, let it be Let it be, let it be, let it be, let it be Whisper words of wisdom, let it be And when the broken hearted people, Living in the world agree There will be an answer, let it be But though they may be parted, There is still a chance that they will see There will be an answer, let it be Let it be, let it be, let it be, let it be There will be an answer, let it be Let it be, let it be, let it be, let it be Whisper words of wisdom, let it be h hh h h hh Let it be, let it be, let it be, let it be Whisper words of wisdom, let it be And when the night is cloudy, there is still a light that shines on me Shine on till tomorrow, let it be I wake up to the sound of music, Mother Mary comes to me Speaking words of wisdom, let it be Let it be, let it be, let it be, let it be Whisper words of wisdom, let it be Let it be, let it be, let it be, let it be Whisper words of wisdom, let it be bbr hh \ \hbbr hh \h h h brbrh x Dead note h Hammeron p Pulloff r Release b Bend br Bend release Slide up \ Slide down ~ Vibrato",C G Am Am7 Fmaj7 F6 C G F E D D C C G Am Am7 Fmaj7 F6 C G F E D D C Am G F C C G F E D D C C G Am Am7 Fmaj7 F6 C G F E D D C C G Am Am7 Fmaj7 F6 C G F E D D C Am G F C C G F E D D C Am G F C C G F E D D C B G D A E B G D A E B G D A E B G D A E B G D A E Am G F C C G F E D D C C G Am Am7 Fmaj7 F6 C G F E D D C C G Am Am7 Fmaj7 F6 C G F E D D C Am G F C C G F E D D C Am G F C C G F E D D C B G D A E B G D A E B G D A E B G D A E
https://tabs.ultimate-guitar.com/tab/john-denver/take-me-home-country-roads-chords-57606,"Life is old there, older than the trees, younger than the mountains, growin' Country Roads, take me home, to the place I belong Country Roads, take me home, to the place I belong And drivin' down the road I get a feelin' that I should have been home Country Roads, take me home, to the place I belong Country Roads, take me home, to the place I belong",G G D G Em D C G G Em D C G G D Em C G D C G G Em D C G G Em D C G G D Em C G D C G Em D F G C G D Em F C G D D7 G D Em C G D C G G D Em C G D C G D G D G
https://tabs.ultimate-guitar.com/tab/jeff-buckley/hallelujah-chords-27336,"Well I've heard there was a secret chord, Heard Secret David Pleased You don't care do ya? It Goes th th minor major the baffled posing lujah Hale lu jah Ha le lu jah Ha le lu jah Ha le lu jah! Well I've heard there was a secret chord, That David played and it pleased the Lord, But you don't really care for music, do ya? It goes like this, the th, the th, The minor fall and the major lift, The baffled king composing hallelujah, Hallelujah, hallelujah, hallelujah, hallelujah Your faith was strong but you needed proof, You saw her bathing on the roof, Her beauty in the moonlight overthrew ya, She tied you to her kitchen chair, She broke your throne and she cut your hair, And from your lips she drew the hallelujah, Hallelujah, hallelujah, hallelujah, hallelujah Baby, I've been here before, I know this room and I've walked this floor, And I've seen your flag on the marble arch, And love is not a victory march, It's a cold and it's a broken hallelujah, Hallelujah, hallelujah, hallelujah, hallelujah There was a time when you let me know, What's really going on below, Well remember when I moved in you, And the holy dove was moving too, And every breath we drew was hallelujah, Hallelujah, hallelujah, hallelujah, hallelujah Maybe there's a God above, But all I ever learned from love, And it's not a cry that you hear at night, It's not somebody who's seen the light, It's a cold and it's a broken hallelujah, Hallelujah, hallelujah, hallelujah, hallelujah Hallelujah, hallelujah, hallelujah, hallelujah h Hammeron p Pulloff",G Em G Em G Em G Em B G D A E G Em G Em B G D A E C D G D B G D A E G C D Em C B G D A E D B7 Em Em B G D A E C Em B G D A E C G D B G D A E G Em G Em B G D A E G Em G Em C D G D G C D Em C D B7 Em C Em C G D G G Em G Em G Em G Em C D G D G C D Em C D B7 Em C Em C G D G G Em G Em G Em G Em C D G D G C D Em C D B7 Em C Em C G D G G Em G Em G Em G Em C D G D G C D Em C D B7 Em C Em C G D G G Em G Em G Em G Em C D G D G C D Em C D B7 Em C Em C G D C Em C G D C Em C D
https://tabs.ultimate-guitar.com/tab/the-beatles/hey-jude-chords-1061739,"Hey Jude chords The Beatles orgwikiHey_Jude Capo III Hey Jude, donÁ™∂ÂÜ≤ make it bad, take a sad song and make it better Remember to let her into your heart, then you can start to make it better Hey Jude, donÁ™∂ÂÜ≤ be afraid, you were made to go out and get her The minute you let her under your skin, then you begin to make it better And anytime you feel the pain, hey Jude, refrain, donÁ™∂ÂÜ≤ carry the world upon your shoulders For well you know that it's a fool who plays it cool by making his world a little colder Da da da da da da da da Hey Jude, donÁ™∂ÂÜ≤ let me down, you have found her, now go and get her Remember to let her into your heart, then you can start to make it better So let it out and let it in, hey Jude, begin, you're waiting for someone to perform with And donÁ™∂ÂÜ≤ you know that it's just you, hey Jude, you'll do, the movement you need is on your shoulders Da da da da da da da da Hey Jude, donÁ™∂ÂÜ≤ make it bad, take a sad song and make it better Remember to let her under your skin, then you begin to make it better Na na na na na na na na na na na, hey Jude Na na na na na na na na na na na, hey Jude Na na na na na na na na na na na, hey Jude Na na na na na na na na na na na, hey Jude Na na na na na na na na na na na, hey Jude Na na na na na na na na na na na, hey Jude Na na na na na na na na na na na, hey Jude Na na na na na na na na na na na, hey Jude Na na na na na na na na na na na, hey Jude Alternates: Capo I m Capo V open Set",D A A7 Asus4 A D G D A A7 D D A A7 Asus4 A D G D A A7 D D7 G Bm Em G A7 D D7 G Bm Em G A7 D D D7 A7 D A A7 Asus4 A D G D A A7 D D7 G Bm Em G A7 D D7 G Bm Em G A7 D D D7 A7 D A A7 Asus4 A D G D A A7 D D C G D D C G D D C G D D C G D D C G D D C G D D C G D D C G D D C G D D C G D D E A B A7 B7 Asus4 Bsus D7 E7 G A Bm C#m Em F#m C D D C A G A7 G7 D7 C7 Asus4 Gsus4 G F Em Dm Bm Ebm C Bb D F A C A7 C7 D7 F7 Asus4 Csus4 G Bb Em Gm Bm Dm C Eb
https://tabs.ultimate-guitar.com/tab/elton-john/your-song-chords-29113,"It's a little bit funny, this feeling inside I'm not one of those who can easily hide I don't have much money, but boy, if I did I'd buy a big house where we both could live If I was a sculptor, but then again, no Or a man who makes potions in a travelling show I know it's not much but it's the best I can do My gift is my song, and this one's for you And you can tell everybody this is your song It may be quite simple but now that it's done I hope you don't mind, I hope you don't mind That I put down in words, How wonderful life is while you're in the world I sat on the roof and kicked off the moss Well a few of the verses, well they've got me quite cross But the sun's been quite kind, while I wrote this song It's for people like you that keep it turned on So excuse me forgetting, but these things I do You see I've forgotten if they're green or they're blue Anyway, the thing is, what I really mean Yours are the sweetest eyes I've ever seen And you can tell everybody this is your song It may be quite simple but now that it's done I hope you don't mind, I hope you don't mind That I put down in words, How wonderful life is while you're in the world I hope you don't mind, I hope you don't mind That I put down in words, How wonderful life is while you're in the world vom Saal May ,",A Eb D G A F#m Bm Em7 Bm A Bm G A C D G A G D Gmaj7 A C F#m Bm Bm A Bm G Gmaj7 D A F Bm D Em7 G A D Gmaj7 A C F#m Bm Bm A Bm G G D A F Bm D Em7 G D A C Bm Em7 Gmaj7 A C Bm Em G Bm Bm A Bm G G6 D F Em G A D G A G D Gmaj7 A C F#m Bm Bm A Bm G Gmaj7 D A F Bm D Em7 G A D Gmaj7 A C F#m Bm Bm A Bm G Gmaj7 D A F Bm D Em7 G D A C Bm Em7 G A C Bm Em G Bm Bm A Bm G G6 D Em G A Bm Bm A Bm G G6 D F Em G D G D A D G D D C
https://tabs.ultimate-guitar.com/tab/cat-stevens-yusuf-islam/father-and-son-chords-84491,"It's not time to make a change, just relax and take it easy You're still young, that's your fault, there's so much you have to know Find a girl, settle down, if you want to, you can marry Look at me, I am old, but I'm happy I was once like you are now, and I know that it's not easy To be calm when you've found something going on But take your time, think a lot, why, think of everything you've got For you will still be here tomorrow, but your dreams may not hh hh xxxxxx How can I try to explain? 'cause when I do he turns away again It's always been the same, same old story From the moment I could talk I was ordered to listen Now there's a way, and I know that I have to go away I know I have to go h h xxx It's not time to make a change, just sit down and take it slowly (Away, away, away You're still young, that's your fault, there's so much you have to go through Find a girl, settle down, if you want, you can marry Look at me, I am old, but I'm happy All the times that I've cried, keeping all the things I knew inside (Stay, stay, stay It's hard, but it's harder to ignore it If they were right, I'd agree, but it's them they know, not me Now there's a way, and I know that I have to go away I know I have to go",G C G G C G B G D A E G D F C Am7 G Em Am Am7 D G D F C Am7 G Em Am Am Am7 D G D C Am7 G Em Am Am Am7 D G D C Am7 G Em D G G C G G C G B G D A E G Bm C Am7 G Em Am7 D G Bm C Am7 G Em D G D C G G C G B G D A E G D C Am7 G Em Am7 D G D C Am7 G Em D G D C G C G G D C Am7 G Em Am D G D C Am7 G Em Am Am Am7 D G Bm C Am7 G Em Am Am Am7 D G Bm C Am7 G Em D G G D D C G
https://tabs.ultimate-guitar.com/tab/james-blunt/youre-beautiful-chords-180394,"But I won't lose no sleep on that, I saw your face in a crowded place, Yeah, she caught my eye, She could see from my face that I was, Fucking high, And I don't think that I'll see her again, I saw your face in a crowded place, La la la la, la la la la, la la la la, la There must be an angel with a smile on her face, But it's time to face the truth,",G G F Em7 Cadd9 G G F Em7 Cadd9 G G F Em7 Cadd9 G G F Em7 Cadd9 D F Cadd9 D F G Cadd9 D F G Cadd9 D F G D F Em7 Cadd9 D F Em7 Cadd9 D F G G F Em7 Cadd9 G G F Em7 Cadd9 G G F Em7 Cadd9 Cadd9 D F G Cadd9 D F G Cadd9 D F G D F Em7 Cadd9 D F Em7 Cadd9 D F G Cadd9 Em7 Cadd9 Em7 Cadd9 Em7 D F Cadd9 D F Cadd9 D F G Cadd9 D F G Cadd9 D F G D F Em7 Cadd9 D F G D F Em7 Cadd9 D F Em7 Cadd9 D F G
https://tabs.ultimate-guitar.com/tab/a-great-big-world/say-something-chords-1429805,It was over my head I'm still learning to love You're the one that I love Say something,Dmaj7 F F#m D Bm Bm Bm G D Asus4 Bm G D Asus4 Bm G D Asus4 Bm G D Asus4 Bm G D Asus4 D Dmaj7 F Gsus2 D Asus4 D Dmaj7 F Gsus2 D Asus4 Bm Gsus2 D Asus4 Bm Gsus2 D Asus4 Bm Gsus2 D Asus4 Bm Gsus2 D Asus4 D Dmaj7 F Gsus2 D Asus4 Bm Gsus2 D Asus4 Bm Gsus2 D Asus4 Bm Gsus2 D A Asus4 Bm Gsus2 D Asus4 Bm Gsus2 D Asus4 Bm Gsus2 D
https://tabs.ultimate-guitar.com/tab/radiohead/karma-police-chords-103398,"Karma Police, arrest this man He talks in maths, he buzzes like a fridge He's like a detuned ra di o Karma Police, arrest this girl Her Hitler hairdo is making me feel ill And we have crashed her party y This is what you'll get This is what you'll get This is what you'll get When you mess with us Karma Police, I've given all I can It's not enough, I've given all I can But we're still on the payro oll This is what you'll get This is what you'll get This is what you'll get When you mess with us For a minute there I lost myself, I lost myself Phew, for a minute there I lost myself, I lost myself For a minute there I lost myself, I lost myself Phew, for a minute there I lost myself, I lost myself",Fadd9 Fadd9 F Am D F Em G Am Fadd9 Em G Am D G D F C Bm Am Bm D Am D F Em G Am Fadd9 Em G Am D G D F C Bm Am Bm D Am D F Em G Am Fadd9 Em G Am D G D F C Bm Am Bm D C D G F#7 C D G F#7 C D G Bm C Bm D Am D F Em G Am Fadd9 Em G Am D G D F C Bm Am Bm D C D G F#7 C D G F#7 C D G Bm C Bm D Bm D G D G D Eadd9 E7 Bm D G D G D Eadd9 E7 Bm D G D G D E7 E7 Bm D G D G D Eadd9 E7 Bm D G D G D Eadd9 E7 Bm D G D G D Eadd9 E7
https://tabs.ultimate-guitar.com/tab/gotye/somebody-that-i-used-to-know-chords-1094597,Now and then I think of when we were together Like when you said you felt so happy you could die Told myself that you were right for me But felt so lonely in your company But that was love and it's an ache I still remember You can get addicted to a certain kind of sadness Like resignation to the end Always the end So when we found that we could not make sense Well you said that we would still be friends But I'll admit that I was glad that it was over But you didn't have to cut me off Make out like it never happened And that we were nothing And I don't even need your love But you treat me like a stranger And that feels so rough You didn't have to stoop so low Have your friends collect your records And then change your number I guess that I don't need that though Now you're just somebody that I used to know Now you're just somebody that I used to know Now you're just somebody that I used to know Now and then I think of all the times you screwed me over But had me believing it was always something that I'd done And I don't wanna live that way Reading into every word you say You said that you could let it go But you didn't have to cut me off Make out like it never happened And that we were nothing And I don't even need your love But you treat me like a stranger And that feels so rough You didn't have to stoop so low Have your friends collect your records And then change your number I guess that I don't need that though Now you're just somebody that I used to know Somebody Somebody Somebody Somebody I used to know That I used to know I used to know,Am G Am G Am G Am G Am G Am G Am G Am G Am G Am G Am G Am G Am G Am G Am G Am G Am G Am G Am G Am G Am G Am G B G D A E Am G Am G Am G Am G B G D A E Am G Am G Am G Am G Am G Am G Am G Am G Am G Am G Am G Am G Am G Am G Am G Am G Am G F G Am G F G Am G F G Am G F G Am G F G Am G F G Am G F G Am G F G Am G F G Am G F G Am G F G Am G F G Am G Am G Am G Am G Am G Am G Am G F G Am G Am G G G G G C Am G F G Am G F G Am G F G Am G F G Am G F G Am G F G Am G F G Am G F G Am G F G Am G F G Am G F G Am G F G Am G F G Am G F G Am G F G Am G F G
https://tabs.ultimate-guitar.com/tab/the-lumineers/ho-hey-chords-1144876,"I've been trying to do it right I've been living a lonely life I've been sleeping here instead I've been sleeping in my bed sleeping in my bed So show me family all the blood that I will bleed I don't know where I belong I don't know where I went wrong But I can write a song I belong with you, you belong with me, you're my sweetheart I belong with you, you belong with me, you're my: sweet I don't think you're right for him Think of what it might've been if you Took a bus to Chinatown and Bowery And she'd be standing next to me I belong with you, you belong with me, you're my sweetheart I belong with you, you belong with me, you're my sweetheart And love, we need it now Let's hope for some Cuz oh, we're bleeding out I belong with you, you belong with me, you're my sweetheart I belong with you, you belong with me, you're my sweet",F C F C F C F C F C F C C F C C F C C Am G F C F C F C C F C C F C C F C C Am G F C Am G C Am G F C F C F C F C F C F C C F C C F C C Am G F C Am G F C Am G C Am G C F C G C F C Gsus G F C G C Am G C Am G F C F C F C F C
https://tabs.ultimate-guitar.com/tab/pnk/just-give-me-a-reason-chords-1183088,"piano arranged for guitar nd part, major triad fades in on intro Right from the start You were a thief, you stole my heart And I your willing victim I let you see the parts of me that weren't all that pretty And with every touch you fixed them Now you've been talking in your sleep, oh oh Things you never say to me, oh oh Tell me that you've had enough Of our love, our love Just give me a reason, just a little bit's enough Just a second, we're not broken, just bent And we can learn to love again It's in the stars, it's been written in the scars on our hearts We're not broken, just bent And we can learn to love again I'm sorry, I don't understand where all of this is coming from I thought that we were fine Your head is running wild again, my dear we still have everything And it's all in your mind You've been having real bad dreams, oh oh You used to lie so close to me, oh oh There's nothing more than empty sheets Between our love, our love, oh our love, our love Just give me a reason, just a little bit's enough Just a second, we're not broken, just bent And we can learn to love again I never stopped, you're still written in the scars on my heart You're not broken, just bent And we can learn to love again Oh, tear ducts and rust I'll fix it for us We're collecting dust but our love's enough You're holding it in, you're pouring a drink No, nothing is as bad as it seems We'll come clean Just give me a reason, just a little bit's enough Just a second, we're not broken, just bent And we can learn to love again It's in the stars, it's been written in the scars on our hearts That we're not broken, just bent And we can learn to love again Just give me a reason, just a little bit's enough Just a second, we're not broken, just bent And we can learn to love again It's in the stars, it's been written in the scars on our hearts That we're not broken, just bent And we can learn to love again Ohhohh, we can learn to love again Ohhohh, we can learn to love again Ohh That we're not broken, just bent and we can learn to love again",Em D A C D G B C G B Am C G B G D A E G G C Em C G G C Em C G Em D A C D Dsus4 Em D A C D Dsus4 Em D A C D G C G B Dsus4 D G D F Em Bm Dsus4 G D F Em Bm Dsus4 G G C Em C G G C Em C G Em D A C D Dsus4 Em D A C D Dsus4 Em D A C D G C G B Am C G B Dsus4 D G D F Em Bm Dsus4 G D F Em Bm Dsus4 Em Em Bm C D Em Bm C Am7 Dsus4 D C C G D F Em Bm Dsus4 G D F Em Bm Dsus4 G D F Em Bm Dsus4 G D F Em Bm Dsus4 Em D A C D G B C G B Am C G
https://tabs.ultimate-guitar.com/tab/bon-iver/skinny-love-chords-835053,"Dsus Come on skinny love just last the year Pour a little salt we were never here My, my, my, my, my, my, my, my Dsus Staring at the sink of blood and crushed veneer I tell my love to wreck it all Cut out all the ropes and let me fall My, my, my, my, my, my, my, my Dsus Right in the moment this order's tall I told you to be patient I told you to be fine I told you to be balanced I told you to be kind In the morning I'll be with you But it will be a different ""kind"" I'll be holding all the tickets And you'll be owning all the fines Come on skinny love what happened here Suckle on the hope in lite brassiere My, my, my, my, my, my, my, my Dsus Sullen load is full; so slow on the split I told you to be patient I told you to be fine I told you to be balanced I told you to be kind Now all your love is wasted? Then who the hell was I? Now I'm breaking at the bridges And at the end of all your lines Who will love you? Who will fight? Who will fall far behind? Dsus",E Am C Am C Am C Am C Am C Am C Am C Am Fmaj7 C Am C Am C Am C Am C C B F C G F C C B F C C B F Am C Am C Am C Am Fmaj7 C C C B F C G F C C B F C C B F C C B F C C B F Am C Am C Am C Am C
https://tabs.ultimate-guitar.com/tab/simon-garfunkel/the-sound-of-silence-chords-159157,"Hello darkness, my old friend, I've come to talk with you again, Because a vision softly creeping, Left its seeds while I was sleeping, And the vision that was planted in my brain Still remains In restless dreams I walked alone Narrow streets of cobblestone, 'neath the halo of a street lamp, I turned my collar to the cold and damp When my eyes were stabbed by the flash of a neon light That split the night And in the naked light I saw People talking without speaking, People hearing without listening, People writing songs that voices never share And no one dare Fools said I, you do not know Hear my words that I might teach you, But my words like silent raindrops fell, And echoed in the wells of silence And the people bowed and prayed And the sign flashed out its warning, And the sign said, the words of the prophets Are written on the subway walls And tenement halls",Am G Am F C F C F C C B Am C G Am G Am F C F C F C C B Am C G Am G Am F C F C F C C B Am C G Am G Am F C F C F C C B Am C G Am G Am F C F C F C C B Am C G Am
https://tabs.ultimate-guitar.com/tab/green-day/21-guns-chords-823449,"Do you know what's worth fighting for, When it's not worth dying for? Does it take your breath away And you feel yourself suffocating? Does the pain weigh out the pride? And you look for a place to hide? Did someone break your heart inside? C You're in ruins F D One, guns C Bb Lay down your arms F C Give up the fight F D One, guns C Bb F C Throw up your arms into the sky, Bb F C You and I When you're at the end of the road And you lost all sense of control And your thoughts have taken their toll When your mind breaks the spirit of your soul Your faith walks on broken glass And the hangover doesn't pass Nothing's ever built to last C F D One, guns C Bb Lay down your arms F C Give up the fight F D One, guns C Bb F C Throw up your arms into the sky, Bb F C You and I D Bb F C Did you try to live on your own D Bb F A When you burned down the house and home? D Bb F A Did you stand too close to the fire? Bb C F Like a liar looking for forgiveness from a stone F D C Bb F C F D C Bb F C Bb F A When it's time to live and let die And you can't get another try Something inside this heart has died F D One, guns C Bb Lay down your arms F C Give up the fight F D One, guns C Bb F C Throw up your arms into the sky F D One, guns C Bb Lay down your arms F C Give up the fight F D One, guns C Bb F C Throw up your arms into the sky, Bb F C You and I",A Bb C Dm F C E Dm Bb F C Dm Bb F C Dm Bb F C Dm Bb F C Dm Bb F C Bb C Dm Bb F C Dm Bb F C Dm Bb F C Bb C E C E Dm Bb F C Dm Bb F C Dm Bb F C Bb C Dm Bb F C Dm Bb F C Dm Bb F C Bb C E C E C E C E Dm Bb F C Dm Bb F C Dm Bb F C Dm Bb F C Dm Bb F C Bb C E C E C E C E
https://tabs.ultimate-guitar.com/tab/shawn-mendes/stitches-chords-1721601,"I thought that I've been hurt before But no one's ever left me quite this sore Your words cut deeper than a knife Now I need someone to breathe me back to life Got a feeling that I'm going under But I know that I'll make it out alive If I quit calling you my lover Move on You watch me bleed until I can't breathe I'm shaking, falling onto my knees And now that I'm without your kisses I'll be needing stitches Tripping over myself, aching begging you to come help And now that I'm without your kisses I'll be needing stitches Just like a moth drawn to a flame Oh, you lured me in, I couldn't sense the pain Your bitter heart cold to the touch Now I'm gonna reap what I sow I'm left seeing red on my own Got a feeling that I'm going under But I know that I'll make it out alive If I quit calling you my lover Move on You watch me bleed until I can't breathe I'm shaking, falling onto my knees And now that I'm without your kisses I'll be needing stitches Tripping over myself, aching begging you to come help And now that I'm without your kisses I'll be needing stitches Needle and the thread, Gotta get you out of my head Needle and the thread, Gonna wind up dead Needle and the thread, Gotta get you out of my head Needle and the thread, Gonna wind up dead Needle and the thread, Gotta get you out of my head Needle and the thread, Gonna wind up dead Needle and the thread, Gotta get you out of my head, get you out of my head You watch me bleed until I can't breathe I'm shaking, falling onto my knees And now that I'm without your kisses I'll be needing stitches Tripping over myself, aching begging you to come help And now that I'm without your kisses I'll be needing stitches I'm without your kisses I'll be needing stitches I'm without your kisses I'll be needing stitches",Am G C F Am G C F Am G C F Am G C F Am G C F F G Am G F G Am Am G C F Am G F C Am G C F Am G F C Am G C F Am G C F Am G C F Am G C F F G Am G F G Am Am G C F Am G F C Am G C F Am G F C Am G C F Am G C F Am G C F Am G C F Am G C C Am G C F Am G F C Am G C F Am G F C C C C C
