URL,Lyrics,Chords
https://tabs.ultimate-guitar.com/tab/ed-sheeran/perfect-chords-1956589,"I found a love for me Darling, just dive right in, and follow my lead Well, I found a girl beautiful and sweet I never knew you were the someone waiting for me Cause we were just kids when we fell in love Not knowing what it was, I will not give you up this tiime Darling just kiss me slow, your heart is all I own And in your eyes you're holding mine Baby, I'm dancing in the dark, with you between my arms Barefoot on the grass, listening to our favourite song When you said you looked a mess, I whispered underneath my breath But you heard it, darling you look perfect tonight Well, I found a woman, stronger than anyone I know She shares my dreams, I hope that someday I'll share her home I found a love, to carry more than just my secrets To carry love, to carry children of our own We are still kids, but we're so in love, fighting against all odds I know we'll be alright this tiime Darling just hold my hand, be my girl, I'll be your man I see my future in your eyes Baby, I'm dancing in the dark, with you between my arms Barefoot on the grass, listening to our favourite song When I saw you in that dress, looking so beautiful I don't deserve this, darling you look perfect tonight Baby, I'm dancing in the dark, with you between my arms Barefoot on the grass, listening to our favourite song I have faith in what I see, now I know I have met an angel In person, and she looks perfect I don't deserve this, you look perfect tonight",G G Em C D G Em C D G Em C G D G Em C D Em C G D Em C G D Em C G D Em C G D G G D F Em D C D G Em C D G Em C D G Em C G D G Em C D Em C G D Em C G D Em C G D Em C G D G G G Em C D Em C G D Em C G D Em C G D Em C G D G B C Dsus4 D G G D F Em D C D G
https://tabs.ultimate-guitar.com/tab/jeff-buckley/hallelujah-chords-198052,"I heard there was a secret chord That David played and it pleased the Lord But you don't really care for music, do you? Well it goes like this the fourth, the fifth The minor fall and the major lift The baffled king composing hallelujah Well, your faith was strong but you needed proof You saw her bathing on the roof Her beauty and the moonlight overthrew you She tied you to her kitchen chair She broke your throne and she cut your hair And from your lips she drew the hallelujah Baby, I've been here before I've seen this room and I've walked this floor I used to live alone before I knew you I've seen your flag on the marble arch But love is not a victory march It's a cold and it's a broken hallelujah Well, there was a time when you let me know What's really going on below But now you never show that to me do you But remember when I moved in you And the holy dove was moving too And every breath we drew was hallelujah Well, maybe there's a God above But all I've ever learned from love Was how to shoot somebody who outdrew you It's not a cry that you hear at night It's not somebody who's seen the light It's a cold and it's a broken hallelujah Halleluuuuuuujah",C Am C Am F G C G C F G Am F G E7 Am F Am F C G C Am C Am C Am C Am F G C G C F G Am F G E7 Am F Am F C G C Am C Am C Am C Am F G C G C F G Am F G E7 Am F Am F C G C Am C Am C Am C Am F G C G C F G Am F G E7 Am F Am F C G C Am C Am C Am C Am F G C G C F G Am F G E7 Am F Am F C G C F Am F C G C F Am F C G C Am F G C
https://tabs.ultimate-guitar.com/tab/elvis-presley/cant-help-falling-in-love-chords-1086983,"Wise men say, only fools rush in But I can't help falling in love with you Shall I stay, would it be a sin? If I can't help falling in love with you Like a river flows surely to the sea Darling so it goes Some things are meant to be Take my hand, take my whole life too For I can't help falling in love with you Like a river flows surely to the sea Darling so it goes Some things are meant to be Take my hand, take my whole life too For I can't help falling in love with you For I can't help falling in love with you Alternate: Open m It has been suggested that or might be a good substitute for This version: comvideossearch?qelvis+presley+cant+help+ falling+in+love+video&viewdetail&midFFDABAAFFDABAA&FORMVIRE Set",C G Am F C G C C Em Am F C G F G Am F C G C C Em Am F C G F G Am F C G C Em B7 Em B7 Em B7 Em A7 Dm G C Em Am F C G F G Am F C G C Em B7 Em B7 Em B7 Em A7 Dm G C Em Am F C G F G Am F C G C C F G Am F C G C C D Em F#m Am Bm F G G A B7 C#7 A7 B7 Dm Em Dm Dm7 F
https://tabs.ultimate-guitar.com/tab/john-legend/all-of-me-chords-1248578,"What would I do without your smart mouth Drawing me in, and you kicking me out Got my head spinning, no kidding, I can't pin you down What's going on in that beautiful mind I'm on your magical mystery ride Amadd And I'm so dizzy, don't know what hit me, but I'll be alright My head's under water Amadd But I'm breathing fine You're crazy and I'm out of my mind Cause all of me Emadd Loves all of you Love your curves and all your edges All your perfect imperfections Give your all to me Emadd I'll give my all to you You're my end and my beginning Even when I lose I'm winning Cause I give you all, all of me And you give me all, all of you, oh How many times do I have to tell you Even when you're crying youÁ™∂ÂÜ≥e beautiful too The world is beating you down, I'm around through every mood You're my downfall, you're my muse My worst distraction, my rhythm and blues I can't stop singing, it's ringing, in my head for you My head's under water Amadd But I'm breathing fine You're crazy and I'm out of my mind Cause all of me Emadd Loves all of you Love your curves and all your edges All your perfect imperfections Give your all to me Emadd I'll give my all to you You're my end and my beginning Even when I lose I'm winning Cause I give you all, all of me And you give me all, all of you, oh Give me all of you Cards on the table Amadd We're both showing hearts Risking it all, though it's hard Cause all of me Emadd Loves all of you Love your curves and all your edges All your perfect imperfections Give your all to me Emadd I'll give my all to you You're my end and my beginning Even when I lose I'm winning Cause I give you all, all of me And you give me all, all of you I give you all, all of me And you give me all, all of you, oh",Em C G D Em Cmaj7 G D Em C G D Em Cmaj7 G D Em Cadd9 G D A Am G D G D G Am C C D D G Am C C D D Em C G Dadd9 Em C G Dadd9 Em C G D Em C G D Em C G D Em C G D Am A Am G D G D G Am C C D D G Am C C D D Em C G Dadd9 Em C G Dadd9 Am B Am G D Am G D G Am C C D D G Am C C D D Em C G Dadd9 Em C G Dadd9 Em C G D Em C G D
https://tabs.ultimate-guitar.com/tab/jason-mraz/im-yours-chords-373896,"Well, you done done me in; you bet I felt it I tried to be chill but you're so hot that I melted I fell right through the cracks Now I'm tryin' to get back Before the cool done run out, I'll be givin' it my bestest and nothin's gonna stop me but divine intervention I reckon it's again my turn To win some or learn some But I won't hesitate No more, no more It cannot wait; I'm yours Well, open up your mind and see like me Open up your plans and damn you're free Look into your heart and you'll find love, love, love, love Listen to the music of the moment, people dance and sing, we're just one big family And it's our Godforsaken right to be loved, loved, loved, loved, loved So I won't hesitate No more, no more It cannot wait, I'm sure There's no need to complicate Our time is short This is our fate, I'm yours Doo do do doo doo do, doo do doo do doo do Do you want to come on, scooch on over closer, dear And I will nibble your ear I've been spending way too long checking my tongue in the mirror And bending over backwards just to try to see it clearer But my breath fogged up the glass And so I drew a new face and I laughed I guess what I'll be saying is there ain't no better reason To rid yourself of vanities and just go with the seasons It's what we aim to do Our name is our virtue But I won't hesitate No more, no more It cannot wait; I'm yours Well, open up your mind and see like me Open up your plans and damn you're free Look into your heart and you'll find that the sky is yours So please don't, please don't, please don't There's no need to complicate 'Cause our time is short This oh, this oh, this is our fate I'm yours Brrbammm, dabammmday Tdu, du, tdu, du, tdu, dudu, duu, dudu Oh, I'm yours Oh, I'm yours Ohohohoh, whoaohohoh Baby, do believe I'm yours You best believe, you best believe I'm yours",G D Em C B G D A E G D Em C G D Em C G D Em C G D Em C G D Em C G D Em C A7 G D Dsus4 Em C G D Em C G D Em D C A7 G Bm Em D C A7 G D Em C G D Em C G D Dsus4 Em C G D Em C G D Dsus4 Em C A7 C G D Em C G D Em C
https://tabs.ultimate-guitar.com/tab/radiohead/creep-chords-4169,"When you were here before, couldn't look you in the eyes You're just like an angel, your skin makes me cry You float like a feather in a beautiful world I wish I was special, you're so fucking special But I'm a creep, I'm a weirdo What the hell am I doing here? I don't belong here I don't care if it hurts, I wanna have control I want a perfect body, I want a perfect soul I want you to notice when I'm not around You're so fucking special, I wish I was special But I'm a creep, I'm a weirdo What the hell am I doing here? I don't belong here Whatever makes you happy, whatever you want You're so fucking special, I wish I was special But I'm a creep, I'm a weirdo What the hell am I doing here? I don't belong here I don't belong here",G B C Cm G B C Cm G B C Cm G B C Cm Cm G B C Cm G B C Cm G B C Cm Cm G B C Cm G B C Cm G B C Cm G B C Cm G B C Cm G
https://tabs.ultimate-guitar.com/tab/ed-sheeran/thinking-out-loud-chords-1486860,"Transpose + to play without a capo When your legs don't work like they used to before And I can't sweep you off of your feet Will your mouth still remember the taste of my love Will your eyes still smile from your cheeks And darling I will be loving you till we're And baby my heart could still fall as hard at And I'm thinking 'bout how People fall in love in mysterious ways Maybe just the touch of a hand Well me, I fall in love with you every single day And I just wanna tell you I am So honey now Take me into your loving arms Kiss me under the light of a thousand stars Place your head on my beating heart I'm thinking out loud And maybe we found love right where we are And when my hair's all but gone and my memory fades And the crowds don't remember my name When my hands don't play the strings the same way I know you will still love me the same Cause honey your soul could never grow old, it's evergreen And baby your smile's forever in my mind and memory I'm thinking 'bout how People fall in love in mysterious ways And maybe it's all part of a plan Well I'll just keep on making the same mistakes Hoping that you'll understand That baby now Take me into your loving arms Kiss me under the light of a thousand stars Place your head on my beating heart I'm thinking out loud That maybe we found love right where we are So baby now Take me into your loving arms Kiss me under the light of a thousand stars Place your head on my beating heart I'm thinking out loud That maybe we found love right where we are Baby, we found love right where we are And we found love right where we are",C C E F G C C E F G C C E F G C C E F G C C E F G C C E F G C C E F G C C E F G Dm G C Dm G Dm G Am Dm G C C E F G C C E F G C C E F G C C E F G Am G F C E Dm G C C C E F G C C E F G C C E F G C C E F G C C E F G C C E F G C C E F G C C E F G Dm G C Dm G Dm G Am Dm G C C E F G C C E F G C C E F G C C E F G Am G F C E Dm G C C C E F G C C E F G C C E F G C C E F G C C E F G C C E F G C C E F G C C E F G Am G F C E Dm G C Am G F C E Dm G C Am G F C E Dm G C
https://tabs.ultimate-guitar.com/tab/vance-joy/riptide-chords-1237247,"I was scared of dentists and the dark I was scared of pretty girls and starting conversations Oh, all my friends are turning green You're the magician's assistant in their dreams Ooh, ooh, ooh Ooh, ooh, and they come unstuck Lady, running down to the riptide, taken away To the dark side, I wanna be your left hand man I love you when you're singing that song, and I got a lump In my throat, 'cause you're gonna sing the words wrong There's this movie that I think you'll like This guy decides to quit his job and heads to New York City This cowboy's running from himself And she's been living on the highest shelf Ooh, ooh, ooh Ooh, ooh, and they come unstuck Lady, running down to the riptide, taken away To the dark side, I wanna be your left hand man I love you when you're singing that song, and I got a lump In my throat, 'cause you're gonna sing the words wrong h I just wanna, I just wanna know If you're gonna, if you're gonna stay I just gotta, I just gotta know I can't have it, I can't have it any other way I swear she's destined for the screen Closest thing to Michelle Pfeiffer that you've ever seen, oh Lady, running down to the riptide, taken away To the dark side, I wanna be your left hand man I love you when you're singing that song, and I got a lump In my throat, 'cause you're gonna sing the words wrong Lady, running down to the riptide, taken away To the dark side, I wanna be your left hand man I love you when you're singing that song, and I got a lump In my throat, 'cause you're gonna sing the words wrong Lady, running down to the riptide, taken away To the dark side, I wanna be your left hand man I love you when you're singing that song, and I got a lump In my throat, 'cause you're gonna sing the words wrong yeah, I got a lump In my throat, 'cause you're gonna sing the words wrong",Am G C Am G C Am G C Am G C Am G C Am G C Am G C Am G C Am G C Am G C Am G C Am G C Am G C Am G C Am G C Am G C Am G C Am G C Am G C Am G C Am G C Am G C C B G D A E Am G C Fmaj7 Am G C Fmaj7 Am G C Am G C Am G C Am G C Am G C Am G C Am G C Am G C Am G C Am G C Am G C Am G C Am G C Am G C Am G C
https://tabs.ultimate-guitar.com/tab/bruno-mars/when-i-was-your-man-chords-1198871,"Same bed, but it feels just a little bit bigger now Our song on the radio, but it don't sound the same When our friends talk about you all it does is just tear me down Cause my heart breaks a little when I hear your name It all just sounds like ooh, ooh, oooh, oooh Mmm too young, too dumb to realize That I should've bought you flowers and held your hand Shoulda gave you all my hours when I had the chance Take you to every party cause all you wanted to do was dance Now my baby's dancing, but she's dancing with another man My pride, my ego, my needs and my selfish ways Caused a good strong woman like you to walk out my life Now I'll never, never get to clean up the mess I made ooh And that haunts me every time I close my eyes It all just sounds like ooh, ooh, oooh, oooh Mmm too young, too dumb to realize That I should've bought you flowers and held your hand Shoulda gave you all my hours when I had the chance Take you to every party cause all you wanted to do was dance Now my baby's dancing, but she's dancing with another man Although it hurts I'll be the first to say that I was wrong Oh, I know I'm probably much too late To try and apologize for my mistakes But I just want you to know I hope he buys you flowers, I hope he holds your hand Give you all his hours when he has the chance Take you to every party cause I remember how much you love to dance Do all the things I should've done when I was your man Do all the things I should've done when I was your man",D7 Dm7 C D7 Dm7 C G B Am C Dm G G7 C Em B Am C Dm G C Em B Am Em Bb C G G F G C F G C F G Am D7 F Fm C F C Em B Am C Dm G G7 C Em B Am C Dm G C Em B Am Em Bb C G G F G C F G C F G Am D7 F Fm C F G C G B Am Em G D7 Dm7 G F G C F G C F G Am D7 F Fm C D7 F Fm C
https://tabs.ultimate-guitar.com/tab/ed-sheeran/photograph-chords-1493446,"Loving can hurt Loving can hurt sometimes But it's the only thing that I know When it gets hard You know it can get hard sometimes It is the only thing that makes us feel alive We keep this love in a photograph We make these memories for ourselves Where our eyes are never closing Our hearts were never broken And times forever frozen still So you can keep me inside the pocket of your Ripped jeans holding me closer till our Eyes meet, you won't ever be alone Wait for me to come home Loving can heal Loving can mend your soul And it's the only thing that I know I swear it will get easier remember that with every piece of ya It is the only thing we take with us when we die We keep this love in a photograph We make these memories for ourselves Where our eyes are never closing Our hearts were never broken And times forever frozen still So you can keep me inside the pocket of your Ripped jeans holding me closer till our Eyes meet, you won't ever be alone And if you hurt me that's okay baby, only Words bleed inside these pages you just Hold me, and I won't ever let you go Wait for me to come home Wait for me to come home Wait for me to come home Wait for me to come home Oh you can fit, me inside the necklace you got when you were next to your heartbeat where I And if you hurt me that's okay baby only Words bleed inside these pages you just When I'm away I will remember how you Kissed me under the lamp post back on sixth street Hearing you whisper through the phone,",D Bm A G D Bm A G D Bm A G Bm G D A Bm G D A D A Bm G D D Bm A G D Bm A G Bm G D A Bm G D A D A Bm G D A Bm G Bm G D A D A Bm G D A Bm G D A Bm G G C
https://tabs.ultimate-guitar.com/tab/oasis/dont-look-back-in-anger-chords-6097,"Slip inside the eye of your mind Don't you know you might find better place to play You said that you'd never been But all the things that you've seen Slowly fade away Fm So I start a revolution from my bed Fm 'Cos you said the brains I had went to my head Fm Step outside, summertime's in bloom Stand up beside the fireplace Take that look from off your face You ain't ever gonna burn my heart out And so Sally can wait, she knows it's too late as we're walking on by Her soul slides away, but don't look back in anger I heard you say Take me to the place where you go Where nobody knows, if it's night or day Please don't put your life in the hands of a rock and roll band, who'll throw it all away Fm I'm gonna start a revolution from my bed Fm 'Cos you said the brains I had went to my head Fm Step outside, the summertime's in bloom Stand up beside the fireplace Take that look from off your face 'Cos you ain't ever gonna burn my heart out So Sally can wait, she knows it's too late as she's walking on by My soul slides away, but don't look back in anger I heard you say Fm So Sally can wait, she knows it's too late as we're walking on by Her soul slides away, but don't look back in anger I heard you say So Sally can wait, she knows it's too late as she's walking on by My soul slides away But don't look back in anger Fm Don't look back in anger Fm I heard you say At least not today",C F C F C G Am E7 F G C Am G A C G Am E7 F G C Am G F C F C F C G E7 G Am G F G C G Am E7 F G C Am G C G Am E7 F G C G Am E7 F G C Am G C G Am E7 F G C Am G C G Am E7 F G C Am G F C F C F C G E7 G Am G F G C G Am E7 F G C Am G C G Am E7 F G C Am G F C G E7 G Am G F G G C C G Am E7 F G C Am G C G Am E7 F G C Am G C G Am E7 F G C Am G C G Am F C G Am E7 F C
https://tabs.ultimate-guitar.com/tab/pink-floyd/wish-you-were-here-chords-44555,"So, so you think you can tell, Heaven from Hell, blue skies from pain. Can you tell a green field from a cold steel rail, a smile from a veil, Do you think you can tell? Did they get you to trade your heroes for ghosts, Hot ashes for trees, hot air for a cool breeze, cold comfort for change, And did you exchange a walk on part in the war for a lead role in a cage? We're just two lost souls swimming in a fish bowl, year after year, What have we found? Wish you were here!",Em7 G B G D A E Em7 B G D A E G B G D A E C D F Am E G D F C Am G C D F Am E G D F C Am G Em7 G Em7 G Em7 Em7 G C D F Am E G D F C Am G Em7 G Em7 G Em7 Em7 G
https://tabs.ultimate-guitar.com/tab/goo-goo-dolls/iris-chords-54512,"And I'd give up forever to touch you 'Cause I know that you feel me somehow You're the closest to heaven that I'll ever be And I don't want to go home right now And all I can taste is this moment And all I can breathe is your life And sooner or later it's over I just don't want to miss you tonight And I don't want the world to see me 'Cause I don't think that they'd understand When everything's made to be broken I just want you to know who I am And you can't fight the tears that ain't coming Or the moment of truth in your lies When everything feels like the movies Yeah, you bleed just to know you're alive And I don't want the world to see me 'Cause I don't think that they'd understand When everything's made to be broken I just want you to know who I am And I don't want the world to see me 'Cause I don't think that they'd understand When everything's made to be broken I just want you to know who I am And I don't want the world to see me 'Cause I don't think that they'd understand When everything's made to be broken I just want you to know who I am I just want you to know who I am I just want you to know who I am I just want you to know who I am",A Bm Bm A Bsus2 G F#m Gmaj7 Bm Bsus2 G Gmaj7 G D Em G Bm A G D Em G Bm A G D Em G Bm A G D Em G Bm A G Bm A G Bm A G Bm A G Bm A G Bm Bsus2 G Gmaj7 G D Em G Bm A G D Em G Bm A G Bm A G Bm A G Bm A G Bm A G Bm Bm A D D Bm Bm A G G Bm Bm A D D Bm Bm A G G Bm Bsus2 G G Bm Bsus2 G G Bm Bsus2 G G Bm Bsus2 G F#m G Bm G F#m Bm Bm G F#m Bm Bm Bm Bm A G G Bm Bm A G G Bm Bm A G G Bm Bm A G G Bm A G Bm A G Bm A G Bm A G Bm A G Bm A G Bm A G Bm A G Bm A G Bm A G Bm A Bm Bm Bm A G G Bm Bm A G G Bm Bm A G G Bm Bm A G G
https://tabs.ultimate-guitar.com/tab/coldplay/the-scientist-chords-180849,"Come up to meet you, tell you I'm sorry, you don't know how lovely you are I had to find you, tell you I need you, tell you I'll set you apart Tell me your secrets and ask me your questions, oh, let's go back to the start Running in circles, coming in tails, heads are a science apart  Nobody said it was easy, it's such a shame for us to part Nobody said it was easy, no one ever said it would be this hard Oh, take me back to the start I was just guessing at numbers and fiigures, pulling the puzzles apart Questions of science, science and progress, do not speak as loud as my heart Tell me you love me, come back and haunt me, oh and I rush to the start Running in circles, chasing tails, coming back as we are Nobody said it was easy, oh, it's such a shame for us to part Nobody said it was easy, no one ever said it would be so hard I'm going back to the start",Bm7 G Gadd9 D Dsus2 Bm7 G Gadd9 D Dsus2 Bm7 G Gadd9 D Dsus2 G Gadd9 D Dsus2 G Gadd9 D Daddb6 D6sus2 A A7 D Bm7 G Gadd9 D Dsus2 Bm7 G Gadd9 D Dsus2 Bm7 G Gadd9 D Dsus2 Bm7 G Gadd9 D Dsus2 G Gadd9 D Dsus2 G Gadd9 D Dsus2 A A7 D
https://tabs.ultimate-guitar.com/tab/eagles/hotel-california-chords-46190,"On a dark desert highway, cool wind in my hair Warm smell of colitas rising up through the air Up ahead in the distance, I saw a shimmering light My head grew heavy and my sight grew dim I had to stop for the night There she stood in the doorway; I heard the mission bell And I was thinking to myself This could be heaven or this could be hell Then she lit up a candle, and she showed me the way There were voices down the corridor, Such a lovely place , such a lovely face Plenty of room at the Hotel California Any time of year , you can find it here Her mind is Tiffanytwisted, she got the Mercedes bends She got a lot of pretty pretty boys she calls friends How they danced in the courtyard, sweet summer sweat Some dance to remember, some dance to forget So I called up the captain; Please bring me my wine We haven't had that spirit here since and still those voices are calling from far away Wake you up in the middle of the night Such a lovely place , such a lovely face They're livin' it up at the Hotel California What a nice surprise , bring your alibis Mirrors on the ceiling; the pink champagne on ice We are all just prisoners here, of our own device and in the master's chambers, they gathered for the feast They stab it with their steely knives but they just can't kill the beast Last thing I remember, I was running for the door I had to find the passage back to the place I was before ""Relax"" said the night man; we are programmed to receive You can check out any time you like But you can never leave",Am E7 G D F C Dm E7 Am E7 G D F C Dm E7 Am E7 G D F C Dm E7 F C E7 Am F C Dm E7 Am E7 G D F C Dm E7 Am E7 G D F C Dm E7 F C E7 Am F C Dm E7 Am E7 G D F C Dm E7 Am E7 G D F C Dm E7 Am E7 G D F C Dm E7 Am E7 G D F C Dm E7
